Number,sdg_result,FundingInstrumentGaReporting,CallDecisionYear,ResearchInstitutionType,MainDiscipline,MainDisciplineLevel2,FundingInstrumentGaLevel1,AmountGranted,IsApproved,Title,Keywords,Abstract,n_applicants,is_collaborative,is_collaborative_cat,n_disciplines,is_interdisciplinary,is_interdisciplinary_cat,disc1,disc2,disc3,disc5,disc6,disc4
172316,07,Fellowships,2016,Other,Physical Chemistry,Chemistry,Careers,74750,TRUE,Single Atom Alloys as Electrocatalysts for CO2 Reduction,Surface Science; Electrokinetics; Electrocatalysis; Electrochemistry; CO2 Reduction,"CO2-derived fuels present an attractive way towards a sustainable energy system. Such fuels can be synthesized from renewable energy by the electrochemical reduction of CO2 in an aqueous electrolyte. To date however, by this process, only CO and formate can be obtained selectively and at reasonable overpotentials. The controlled production of hydrocarbons and oxygenates, both highly desirable products, remains out of reach. At the origin of these troubles are scaling relations in the C-C coupling process, as well as an insufficient understanding of the catalyst surface chemistry. The present project aims at modifying metal surfaces with highly dispersed heteroatoms. The project aims at studying the changes in catalytic activity and selectivity provoked by the presence of single heteroatoms. It is expected that heteroatoms, embedded into metal surfaces, provide the sites necessary for C-C coupling to take place.The studies will aim to uncover design principles about single atom promotion of electrocatalysis. The structure-activity relationships developed as part of this work will lay the foundation for a broad application of the investigated electrode structures to important electrochemical reactions critical to the renewable energy economy and are expected to be of great interest to the community.; Surface Science; Electrokinetics; Electrocatalysis; Electrochemistry; CO2 Reduction",1,0,Non-collaborative,2,1,More than one discipline,20300,20500,NA,NA,NA,NA
195245,07,Fellowships,2020,Other,Legal sciences,"Economics, law",Careers,68650,TRUE,Development and Management of Transboundary Hydropower Project: An Integrated Legal Approach,Hydropower; Sustainability; energy; Human rights; Development; integrated approach,"Contributing more than 50 percent of the Swiss electricity generation, Hydropower represent a central pillar of the Switzerland’s energy system and is a crucial component in attaining the intended Energy Strategy 2050 targets, in particular the phase out of nuclear energy, which represent 40 percent of the domestic electricity supply (WP3, 2015/10). Similarly, hydropower forms a significant part of the energy transition strategy of many countries. At the global level, hydropower contributes to about 16 percent of the electricity supplies and an estimate of 80 percent of the hydropower potential remaining untapped. (International Energy Agency, 2010).  Many of these world’s hydropower potential and proposed developments are located in river that cross sovereign borders, where the existing regulatory framework is weak and can cause irreversible consequences, such as the case in the Gorges Dam, the Hoover Dam and the Aswan Sam (Dunar & Mcbride, 1993; Fearnside, 1998; Qiu, 2011; Misser, 2013).  There are also enormous number of actors involved in transboundary hydropower project, including development and investment banks, foreign government (investors), multilateral energy construction companies, law firms, inter-government and non-government organisation, individual or group (indigenous or local communities), basin or river authorities, individual state party (representatives) and sometimes the subnational state party, individual government sectors, etc. These actors usually have varying and perhaps even competing interest and power, but most importantly and for purpose of this project, they also have varying regulating legal regimes.  These legal regimes include international water law, International human rights law, international (economic) investment law and laws of international organisations. There is need to understand these legal regimes, to be able to sustainably develop and effectively manage transboundary hydropower project, as well as peacefully resolve their disputes. As has been highlighted in the above analysis, transboundary hydropower project raises many complicated issues and involves various legal regimes. A good understanding of these regimes is essential for effective development and management transboundary project, as well as resolution of their evolving disputes.  Better still, a good understanding of the interaction between the regimes will make for sustainable development and effective management of transboundary hydropower project, as well as peaceful settlement of their disputes. This research project seeks to systematize the legal rules in transboundary hydropower development, management, as well as their dispute resolution. As a research output, the research project will provide a comprehensive list of legal principles or rules from the relevant regimes for the development and management of transboundary hydropower projects. To achieve these broad objects, the study will utilize an integrated legal research methodology.  Integrated legal research approach is essential where a particular legal research object traverse more than one legal regime, such as the transboundary hydropower projects. The approach consists of the identification of applicable legal rules in the relevant regimes and comparative analysis of these rules. The comparative analysis will highlight the similarities and linkages within the various applicable rules. For the purposes of the comparative analysis, the research methodology will also involve the development of analytical frameworks. The analytical frameworks will be streamlined to the relevant issues of transboundary hydropower development and management and their dispute settlement, in order to make for a credible analysis.  The study is essentially a legal research project and will reflect doctrinal legal approach - such as, the decision of the courts, treaty practices, rules of customary international law - especially in the analysis of the various legal rules and principles. The relevance of the research project in contribution to scholarship and the society is vast and its impact is very substantial. The research will go a long way in bridging the literature gap, systemize the applicable rules and offer a new perspective to the study and analysis of transboundary hydropower management. The study will permit an advanced new insight that will enhance the comprehension of the concepts and mechanisms developed in the existing literature so far. The methodological approaches employed in the research will lead to a better appreciation of the sustainable management of transboundary hydropower projects. The need for an integrated legal research is particularly key in development and management of transboundary hydropower project. Such project usually impacts are multi-sectoral and susceptible to several uses - it can be used for flood control, tourism, and electricity, etc- and requiring coordination in its development and management.  Although, the study is focused on transboundary hydropower management, the framework could be adopted to localized situations and provide a vital reference to practitioners and scholarship. This will provide a ready-made instrument for policy and decision makers alike as they strive to understand and settle transboundary dam disputes.; Hydropower; Sustainability; energy; Human rights; Development; integrated approach",1,0,Non-collaborative,2,1,More than one discipline,10700,10600,NA,NA,NA,NA
170079,07,Project funding,2016,Cantonal university,Neurophysiology and Brain Research,Basic Medical Sciences,Projects,429000,TRUE,Synaptic trading: energy savings versus information,energetic optimality; multicompartment neuron models; synaptic energy consumption; information theory; brain energy,"Information transmission in the brain is energetically expensive, yet has to satisfy demands of speed and signal-to-noise reliability. We have recently shown that the strong retinogeniculate synapse relaying information from the retina to the thalamus resolves these competing constraints by maximizing energetic efficiency when transferring information. In their physiological state, these synapses are not set to transmit the maximum amount of information possible: information transmission increases when larger excitatory postsynaptic currents (EPSCs) are injected into the postsynaptic thalamic neuron. However, EPSCs that are larger or smaller than physiological EPSCs decrease the information transmitted per energy used. The physiological EPSC size therefore maximizes energy efficiency rather than pure information transfer across the synapse. In other words, the retinogeniculate synapse trades information for energy savings.This finding echoes our earlier finding that, for information being transmitted at a synapse in the presence of noise, a low presynaptic release probability is the optimal solution to maximize the information transmitted per energy expended on the transmission, providing an exciting explanation for the previously not understood fact that synapses are extremely unreliable, often only releasing neurotransmitter a quarter of the times that an action potential is fired.Together, these findings suggest maximization of information transmission per energy used as a design principle in the brain. However, it is unclear how broadly this principle applies. Whether energy efficiency at excitatory synapses is a special property of strong relay synapses, or a more general principle, also governing synaptic inputs that contribute more weakly to determining the output of the postsynaptic cell is an open question. These findings also raise the question of what mechanisms are in effect in order to achieve energetic efficiency of information transfer at synapses.This project will address these questions using information theory and simulations of biologically validated neuron models. In particular, we will investigate under which conditions energetic efficiency of information transfer arises at weak synapses, what biophysical properties of neurons give rise to energetic efficiency of information transfer and how it can be modulated by local network activity. Finally, we will test the hypothesis that energetic efficiency of information transfer is an emergent property of Hebbian learning, more specifically of spike-timing dependent plasticity. In addressing these questions, this project will open a novel avenue to study neural coding by clarifying the natural physical energetic constraints the brain has to do with. This approach eventually holds the potential to identify some of the mechanisms which link energy consumption at synapses to pathologies. Additionally, this approach might open new avenues in the design of artificial computing systems where energy reduction techniques are now being introduced.; energetic optimality; multicompartment neuron models; synaptic energy consumption; information theory; brain energy",1,0,Non-collaborative,2,1,More than one discipline,30300,30100,NA,NA,NA,NA
184280,07,Fellowships,2018,Other,Material Sciences,Engineering Sciences,Careers,109850,TRUE,From the fields to functional materials: bio-renewable polymers from the iron weed plant,Bio-renewable polymers; renewable alternatives ; Ironweed plant; super-critical carbon dioxide; functional materials; hydrolysable polymer; cradle to cradle; polyesters; biodegradability ; polymer waste management,"Polymers have become an inseparable part of our modern lives and it is hard to imagine now a world without polymer products. The field of polymer science is so important to us that in the last six decades, seven noble prices have been won for research within this field. In recent times, polymer waste management issues and the dwindling reserves of fossil fuel, the main source of polymer feedstock, have caused concerns to be raised about the future. Current approaches to confront these concerns involve looking to plant sources for renewable alternatives and the design of polymers with hydrolysable chains to impart biodegradability function to them. However, most renewable sources of monomers are food crops and thus relying on them for our polymer needs will have a negative effect on world food supply. Also, many of the processes utilized to obtain the monomers and to introduce biodegradability into polymeric materials are neither clean, green nor sustainable. With time, the hands of governments around the world will be forced to make regulations enforcing safer working conditions, cleaner production processes and products with better end of life options.This project aims to address these problems by making bio-renewable and biodegradable polymers utilizing monomers made from the oil extracted from the seeds of the Iron weed plant, Vernonia galamensis sp, a non-food crop which grows in arid areas and so does not take the space needed for growing food crops. The project will employ processes that are cleaner than the state of the art; supercritical carbon dioxide, a green solvent will be utilized and enzymes will be used instead of toxic metal catalyst for polymer synthesis. The project will show that we can indeed make sustainable polymers for practical applications and also demonstrate that ‘greener’ processes are not necessarily less efficient but can be more efficient than conventional processes upon careful optimization.; Bio-renewable polymers; renewable alternatives ; Ironweed plant; super-critical carbon dioxide; functional materials; hydrolysable polymer; cradle to cradle; polyesters; biodegradability ; polymer waste management",1,0,Non-collaborative,2,1,More than one discipline,20500,20300,NA,NA,NA,NA
202906,07,Fellowships,2021,Other,Chemical Engineering,Engineering Sciences,Careers,100000,TRUE,Electrochemical N2 reduction in gas diffusion-based electrolysis systems,ammonia production; gas diffusion electrolyzers; electrocatalysis; nitrogen reduction,"Ammonia (NH3) is an essential chemical that directly related to the propagation and prosperity of human society. It is not only a critical ingredient in current agricultural, pharmaceutical, and light industries, but also an ideal fuel due to properties such as high power density, carbon-neutral, and easy storage and transportation. The current NH3 production largely relies on the traditional Haber-Bosch process (up to 90 % of global production), which is performed at high temperature (673 - 873 K) and pressure (20 - 40 MPa). Such harsh synthetic conditions require intensive energy input, resulting in 1 - 3 % global energy consumption annually. Thus, more efficient and advanced synthetic method is desired.Electrochemical reduction reaction of N2 to NH3 (ENRR) that operates at ambient conditions is emerging as a promising alternative to Haber-Bosch process due to its potential to reduce the capital costs. In recent years, increasing efforts have been made, mostly in developing new catalyst materials toward ENRR. However, most of the previous reports have to face reliability challenges, mostly in accurately determining the amount of produced ammonia due to its low yield. The difficulties lie in the facts that (1) N2 is kinetically stable, hence the electrolysis requires a large overpotential; and (2) N2 has very low diffusivity and solubility in water, but most of the electrolysis was performed in a H-cell with aqueous electrolyte, leading to low current density. While N2’s high kinetic barrier issue cannot be changed or circumvented, its low diffusivity and solubility issue can be avoided by changing the way of electrolysis.Here I propose to improve the low NH3 yield and solve the unreliability problems in current ENRR studies by conducting electrolysis in gas diffusion-based devices (e.g., flow cell, MEA, etc.). In these cells, the N2 diffusion coefficient is 4 order of magnitudes higher than in water, and the concentration of gaseous N2 is 60 times of its solute form, both factors can contribute to a significant increase in ENRR rate. My research works will cover both catalysts development and electrolyzer optimization. I will rationally design new electrocatalysts, studying their structure-reactivity relationship with state-of-the-art characterizations. The prepared catalysts will then be applied to a gas diffusion-based electrolyzer. By engineering the electrolyzer structure and electrode-electrolyte-gas interface, a great number of triple-phase boundary sites are expected. Combining the advanced electrolyzer with novel catalysts, I aim to enhance the NH3 production rate one to two orders of magnitudes higher than the current record with a high Faradic efficiency and energy efficiency. If this goal is achieved, it will provide a more reliable method for screening ENRR catalysts. Moreover, it will be marked as important progress toward electrochemical scale-up production of NH3 and a milestone in the field of ENRR.; ammonia production; gas diffusion electrolyzers; electrocatalysis; nitrogen reduction",1,0,Non-collaborative,2,1,More than one discipline,20500,20300,NA,NA,NA,NA
200800,07,Project funding,2021,Cantonal university,"Neurology, Psychiatry",Clinical Medicine,Projects,597507,TRUE,EEGMANN: Energy-Efficient Processing of Intracranial EEG based on Memory-Augmented Neural Networks,Epilepsy; EEG; Energy Efficient Hardware; Hyperdimensional Computing; Phase-Change Memory; Neurology; Digital Biomarker,"Implantable devices for out-of-hospital monitoring of intracranial electroencephalographic signals (iEEG) over months to years have the potential to revolutionize diagnostics and treatment of patients suffering from pharmacoresistent epilepsies by enabling personalized medicine on an unprecedented scale. One of the most basic signal processing tasks to be accomplished by these devices is to detect epileptic seizures. However, current methods for seizure detection are impaired by two main limitations, namely the typically small set of iEEG seizure examples available for training with in addition significant variability among patients, and the very restricted energy and space of implantable devices. To meet these challenges we here set out to combine methods from brain-inspired hyperdimensional computing (HDC) and memory-augmented neural networks (MANN) to design a framework we refer to as EEGMANN. The two specific main goals of EEGMANN are: 1. To develop a hybrid learning method that can quickly generalize from very few iEEG seizure examples. To this end, we will exploit episodic training to first construct a patient-independent feature extractor using our extensive offline iEEG dataset recorded from a large number of patients. This global feature extractor will then be personalized by connecting to an explicit memory that is quickly trained online by few iEEG seizure examples from an individual patient. Thus, this hybrid methodology effectively makes use of the information contained in inter- and intraindividual iEEG seizure recordings, and as a practical result we plan its deployment in the epilepsy monitoring unit. 2. To then significantly improve the energy efficiency of EEGMANN to meet the requirements for the next generation of implantable iEEG monitoring devices. We will utilize cutting edge non-volatile computational memories designed for extreme energy efficiency. Adapting MANN to conform with HDC characteristics will facilitate this objective. HDC manipulates and compares large patterns within memory, which is a highly parallel and extraordinarily noise-tolerant approach due to its holographic representations, i.e. the crucial property that information is evenly spread across the whole extent of the patterns. The parallelism and noise tolerance makes HDC an excellent candidate for nanoscale fabrics such as the IBM computational phase-change memory. As the main result of EEGMANN we expect to develop a novel seizure detection method that makes use of the IBM computational phase-change memory. The impact on the field of epileptology will be that implementation of EEGMANN on this analog computational memory fabric will promote a new generation of extremely energy-efficient and thus smaller implantable iEEG processing devices, which will contribute to the dawning revolution of highly personalized out-of-hospital treatments of patients suffering from pharmacoresistent epilepsies. The broader impact of EEGMANN will be its potential applications in diagnostics and therapies of other neurological and neurodegenerative disorders and for different types of brain--machine interfaces.; Epilepsy; EEG; Energy Efficient Hardware; Hyperdimensional Computing; Phase-Change Memory; Neurology; Digital Biomarker",2,1,Collaborative,2,1,More than one discipline,30700,20500,NA,NA,NA,NA
169215,07,Project funding,2016,ETH Domain,Chemical Engineering,Engineering Sciences,Projects,194918,TRUE,Advancing block co-polymers for organic electronic applications,Polymer; Self-assembly; Crystallinity ; Transistor; Photovoltaic; Organic; Semiconductor; Engineering,"While solution-processed organic semiconductor based photovoltaic devices have recently surpassed the 10% power conversion efficiency benchmark, critical aspects preventing their widespread commercialization remain. Primarily, increasing the device stability and removing the ubiquitous fullerene electron acceptor materials are urgently needed. In this project we propose to extend the material preparation methodology already proven in our labs to develop new all-conjugated block-copolymers (beyond the current state-of-the-art) that will allow unprecedented control over the crystallinity and phase separation of the donor and acceptor species used in organic solar cells. We will demonstrate that it is possible thermodynamically prevent phase segregation with our block co-polymer concept with materials and show photovoltaic device stability improvement. Broadly our development of semiconducting materials with unique properties will afford insights into the links between self-assembly (crystal structure) and optoelectronic performance. Since our novel materials should simultaneously provide excellent thermal stability and low cost, our work will facilitate development of low-cost, large area and flexible displays, sensors and solar cells based on conjugated co-polymers.; Polymer; Self-assembly; Crystallinity ; Transistor; Photovoltaic; Organic; Semiconductor; Engineering",1,0,Non-collaborative,2,1,More than one discipline,20500,NA,20300,NA,NA,NA
166098,07,Project funding,2016,ETH Domain,Applied psychology,"Psychology, educational studies",Projects,259813,TRUE,Development and test of a decision support system for energy portfolio choices among different stakeholders in Switzerland,decision support system; energy strategy; decision making; laypeople ; stakeholders; climate change,"Finding an energy strategy is a rather complex decision task, and laypeople are not capable or willing to consider the many attributes of different energy sources at the same time. Previous research has shown that a so-called decision support system (DSS) can facilitate complex decision tasks in laypeople. It is however still unknown how laypeople work and form decisions with a DSS when developing an energy portfolio. Moreover, little is known about how other stakeholders perceive laypeople’s energy portfolios that resulted from a DSS. We therefore aim to find out how people assemble their preferred energy portfolios with a DSS. For this purpose, we will develop a DSS for energy portfolios that can be used by laypeople and other stakeholders. We will then find out what these private preferences for energy portfolios mean in a public process, where laypeople create energy scenarios, and analyse what consequences this public viewpoint may have for a Swiss energy strategy in the short and medium term future as well as on the country’s climate goals. The materials (the DSS) and findings of this project will help optimizing a country’s future energy strategy, as well as improve decision-making science regarding human information processing and environmental science by improving the scenario models used to assess the impact of energy consumption on our future climate.; decision support system; energy strategy; decision making; laypeople ; stakeholders; climate change",1,0,Non-collaborative,2,1,More than one discipline,10500,20700,NA,NA,NA,NA
