Number,sdg_result,FundingInstrumentGaReporting,CallDecisionYear,ResearchInstitutionType,MainDiscipline,MainDisciplineLevel2,FundingInstrumentGaLevel1,AmountGranted,IsApproved,Title,Keywords,Abstract,n_applicants,is_collaborative,is_collaborative_cat,n_disciplines,is_interdisciplinary,is_interdisciplinary_cat,disc1,disc2,disc3,disc5,disc6,disc4
196898,07,Project funding,2020,ETH Domain,Material Sciences,Engineering Sciences,Projects,355736,TRUE,Pushing the frontier in 3D X-ray microscopy,X-ray nano tomography; High-resolution 3D imaging; X-ray ptychography,"3D X-ray ptychography is a lens-less imaging technique pioneered at the Paul Scherrer Institut (PSI). In the multi-keV energy range it allows combining high penetration and resolution, thereby non-destructive imaging, in the nanometer resolution range in large volumes, an imaging regime otherwise uncovered. Over the last decade several microscopes dedicated to 3D ptychography have been developed and built at PSI, including a continuous development of the related data reconstruction pipelines. Today, imaging is routinely done and thus scientific questions in the areas from biology to materials science can be investigated. In high-contrast samples a 3D resolution of below 10 nm has been reached, which is more than an order of magnitude improvement over more conventional X-ray tomography approaches.Founding on our world-leading instrumentation and resolution, we will further shrink the resolution gap to electron microscopy in this project by improving resolution down to 3 nm. Resolution is sample dependent, and is ultimately limited by radiation damage. In this project we aim at reaching highest resolution in high-contrast, radiation insensitive samples. This will allow 3D ptychography to replace current destructive imaging techniques and directly contribute to the development of material science. Our project will thereby generate important knowledge on ultimate X-ray microscopy limits. Most synchrotrons around the word, including the Swiss Light Source, undergo upgrade programs towards a diffraction limited storage ring. Ptychography can directly employ the expected increase in coherent flux and the present project will deliver an important knowledge base needed for improved imaging at next-generation storage rings.Increasing resolution in 3D ptychographic imaging requires addressing several limiting factors. Experiments with stepwise increasing difficulty are planned. All samples have scientific relevance and the related science projects will directly benefit from higher resolution: In a first step, developments and imaging demonstrations will be performed on a 3D gyroid sample. These are binary objects with high contrast and have proven very radiation hard. At currently reachable resolution data analysis suffers and measurements of samples with smallest structures are not possible. In a second step such demonstrations will be extended to the imaging of integrated circuits (ICs). Microscopy of ICs is the foundation for the optimization of production and design, as well as for failure analysis and the detection of malicious hardware for critical applications. Already in the sub-20 nm resolution range, 3D ptychography has proven useful for the imaging of ICs, allowing resolving the chip’s connectome. Here we envision to perform the first imaging of a damage caused by electrostatic discharge. Today such imaging and analysis is done via destructive methods, which unfortunately can cause damage during the imaging process. Finally, the imaging of polymer electrolyte water electrolysis (PEWE) anodic catalyst layers is planned. PEWE offers great opportunities for storing excess electricity provided by fluctuating renewable energy sources. However, long-term operation is required for the widespread commercialization of this technology. The related particles are covered by a layer, which currently cannot be resolved by our X-ray tomography. This layer is however crucial for the functioning of PEWE cells and resolving it in 3D will be of direct impact in the related electrochemistry projects.; X-ray nano tomography; High-resolution 3D imaging; X-ray ptychography",1,0,Non-collaborative,2,1,More than one discipline,20500,20400,NA,NA,NA,NA
166888,07,Ambizione Energy,2016,ETH Domain,Inorganic Chemistry,Chemistry,Careers,716027,TRUE,Accelarated Discovery of Nanoporous Visible Light Active Materials for Hydrogen Evolution,hydrogen evolution; photocatalysis; metal organic frameworks; visible light active ligands; composites; covalent organic frameworks,"The proposed project concentrates on the area of photocatalysis, with the challenging goal of developing a synthetic platform based on highly tunable visible light active materials namely metal organic frameworks (MOFs), covalent organic frameworks (COFs) and composites (materials that can be generated through the combination of MOF or COF crystals with inorganic and organic nanoparticles) that can be catalytically able to utilise solar energy and drive chemical processes. Our focus will be in combining the absorption (ligand) and/or catalytic site (metal centre) and/or co-catalyst (e.g. platinum nanoparticles) utilised by current photocatalysts into a singular crystalline high surface area material, constructing an ‘ideal’ nanoporous photocatalyst that when placed in water with sunlight can split water into hydrogen and oxygen, with the hydrogen being captured and used as a fuel.MOFs are infinite networks consisting of metal ions or clusters bridged by organic ligands through a covalent bond into a porous structure. COFs are also porous networks constructed solely by organic ligands linked to each other through strong covalent bonds. The flexibility offered by these high surface area materials to incorporate any ligand or any metal ion (in the case of MOFs), together with the integration of various functionalities within their structures to form thermally, chemically and water stable materials, offer advantages that so far have provided limited success in hydrogen generation applications. Thus the long-term aim of the project is to use the flexibility of these materials to systematically study and improve the overall solar efficiency to a commercial viable level and showcase the potential of these nanoporous materials as photocatalysts for water splitting.Utilising the world-class infrastructure within the LSMO lab and at EPFL Valais Wallis, the project intends to start with the strategic construction of water stable MOFs based on a number of visible light active ligands (based on various conducting chromophores) and high valence or transition metal ions utilising the automated robotic synthesiser. Photoactive ligands will be also incorporated within the structures of COFs and so analogues to the carbon-nitride g-C3N4 photocatalyst can be constructed. The main advantage of this synthetic platform is that we can use the chemical flexibility of MOF/COF chemistry to systematically study the effects of different visible light active ligands within their structures. To advance our studies, we intend to generate composite based hybrid materials by combining MOF or COF crystals with four distinct families of NanoParticles (NP) that can potentially improve the hydrogen generation efficiency. The synthesis of novel composites that marry the best properties of each component is highly beneficial as with the nanoporous MOF/COF able to absorb in the visible region of the spectrum, electronic contact between MOF/COF and NP will facilitate the excited state ligand electron to migrate to the NP, in a process analogous to that used in peroviskite or dye-sensitized solar cells and allow the NP, with its reducing metal centre to participate in redox reactions. The materials isolated are going to further be grown/integrated on conducting surfaces and tested as part of a photochemical cell, characterising the photoactivity of the generated composites under visible light, and so demonstrating electric contact between the components of the composite itself.As a final step of the project, we aim to develop a novel high-throughput protocol for testing the potential of these materials for hydrogen generation. The combination of the automated synthesis providing potentially many candidate nanoporous visible light active materials with a next generation Gas Chromatography, capable of automatically testing up to 108 individual samples, will enable us to assess the photocatalytic performance of these materials in short periods of time, identify an ‘ideal’ material with superior performance towards water splitting with high hydrogen evolution efficiency, study and understand its activity in great detail and then scale up its synthesis and test its potential in industrial scale.Whilst an application such as this one, is impressive and with inspiring goal, its actual achievement and commercial viability is very challenging. Its impact, however, can be extremely high as it can provide a clean, renewable energy, without producing greenhouse gases or having many adverse effects to the atmosphere.; hydrogen evolution; photocatalysis; metal organic frameworks; visible light active ligands; composites; covalent organic frameworks",1,0,Non-collaborative,2,1,More than one discipline,20300,20500,NA,NA,NA,NA
180669,07,Fellowships,2018,Cantonal university,Condensed Matter Physics,Physics,Careers,125386,TRUE,Improved methods for theoretical materials design,Water Splitting; Structure Prediction; Photocatalysis; Surface; Interface; Machine Learning,"The proposed research is aimed at developing and applying machine learning methods to study energy materials. In particular, I will use novel artificial neural network potentials to explore the surface structures and thermodynamics of TiO2 nano particles, which are touted as promising materials for environmental friendly hydrogen production. In contrast to similar research projects, I will investigate the materials properties not only for highly idealized conditions, but in environments which reflect realistic conditions encountered in water splitting applications. Ultimately, the goal is to establish design rules for new, improved photocatalytic materials. By going beyond the conventionally used approximate conditions, the expected results from this project will be of value for a better understanding of surface structures and their chemical activity for a wide range of materials.; Water Splitting; Structure Prediction; Photocatalysis; Surface; Interface; Machine Learning",1,0,Non-collaborative,3,1,More than one discipline,20400,20500,20300,NA,NA,NA
179219,07,Project funding,2018,ETH Domain,Social geography and ecology,"Ethnology, social and human geography",Projects,329767,TRUE,Global Socio-technical Regimes in the Water Sector (GLORIWA),infrstructure; sustainability transition; urban water management; socio-technical regime; globalization,"The GLORIWA project aims at analyzing the global actor structure and institutional rationalities that stabilize dominant designs in urban infrastructure. The project starts from the observation that infrastructure solutions in energy, water or transportation use the same design principles all over the world, even though the material and cultural preconditions vary greatly between places. Change toward locally adapted (and potentially more sustainable) solutions is hindered by dominant designs that are hard to change even by the most visionary entrepreneurs. In GLORIWA, this lock-in is attributed to internationalized actor structures and institutional rationalities that stabilize and diffuse a dominant model of ‘modern’ infrastructure in space (i.e. global socio-technical regimes).Conceptualizing socio-technical regimes as ‘global’ is a radically novel idea at the intersection of transition studies, innovation studies and economic geography. Transition literature to date almost exclusively drew national or regional spatial boundaries, assuming that infrastructure transformation (e.g. the transition from fossil to renewable energy) plays out predominantly at urban, regional or national scales (Coenen et al., 2012). Whether and how transformation dynamics are influenced by international interdependencies in today’s quickly globalizing knowledge economy has been largely ignored (Fuenfschilling and Binz, 2017). The GLORIWA project aims at filling this gap by 1) further specifying and operationalizing transition studies’ socio-technical regime concept, 2) analyzing how certain design principles gain dominance in international arenas, and 3) assessing global regime rationalities diffuse in space. By visualizing and analyzing the global actor structure in urban water management, GLORIWA will unpack in detail the mechanisms through which a regime rationality stabilizes and influences infrastructure design decisions in various places around the world. The global socio-technical regime in urban water management will be reconstructed based on a mix of quantitative and qualitative methods and data sources. Secondary databases will be revised to qualitatively map the global actor structure in urban water management. Social Network Analysis and Discourse Network Analysis will then be used to examine which firms, consultants or NGOs occupy the most central network position in this actor structure and thus enjoy definitional authority in framing certain technologies as global model solution. This quantitative analysis will then be combined with qualitative expert interviews in order to reconstruct in detail the process through which dominant regime solutions are diffused beyond their place of origin. The results from the water sector will be cross-compared with a parallel research initiative at Lund University, Sweden, conducting regime analyses in the chemical and paper and pulp sectors. By systematically mapping and analyzing these global structures, GLORIWA and its partner activities will contribute novel ideas on how infrastructure transformation may be understood and governed not only at a national, but increasingly at an international level.; infrstructure; sustainability transition; urban water management; socio-technical regime; globalization",1,0,Non-collaborative,2,1,More than one discipline,10400,10600,NA,NA,NA,NA
174475,07,Fellowships,2017,Other,Condensed Matter Physics,Physics,Careers,27460,TRUE,Improved methods for theoretical materials design,Electronic Structure; Simulation; Structure Prediction; Materials Design,"Materials design has become one of the most rapidly increasing fields of condensed matter science during the last years. Discovery of novel materials are called for with potential applications in various technologically relevant fields such as energy production and storage, novel electronic devices, data storage, medical application and catalysis. Instead of synthesizing and characterizing novel materials in time-consuming, expensive experiments, theoretical material scientists have started to create databases obtained from all materials known to date and to systematically analyze them with high-throughput computation methods, trying to gain insight on how chemistry and structures are linked to material properties and to extract patterns from the underlying data. New, innovative computational methods are needed to efficiently characterize the continuously growing amount of materials data, and techniques need to be developed to extrapolate materials properties to design novel, undiscovered compounds with improved properties. The presented project is aimed at solving two key limitations in materials design. First, most structure prediction methods do not access the knowledge stored in the large structural databases. By combining the Minima Hopping structure prediction scheme and machine-learning techniques a sophisticated method will be developed to explore new chemistries and to discover compounds with improved or new properties in energy applications. The new method will be applied to real-life challenges in materials design to find thermoelectric and hydrogen storage materials, or materials for use in photovoltaic applications. Second, Quantum Monte Carlo methods will be used to refine the energetic ordering of different phases in various compounds to significantly improve the predictive power by going beyond the accuracy of conventional density functional theory calculations used in current approaches. The outcome of this project will be of great value for many material scientists and will considerably accelerate the theoretical discovery of novel materials.; Electronic Structure; Simulation; Structure Prediction; Materials Design",1,0,Non-collaborative,2,1,More than one discipline,20400,20500,NA,NA,NA,NA
186999,07,ERA-NET,2019,Cantonal university,Microelectronics. Optoelectronics,Engineering Sciences,Programmes,813294,TRUE,Spiking Memristive Architectures for Learning to Learn,Recurrent Neural Network (RNN); Neuromorphic hardware; Learning; Edge computing; Memristor; Spiking Neural Network (SNN),"Contemporary AI applications often rely on deep learning, which implies heavy computational loads with current technology. However, there is a growing demand for low-power autonomously learning AI systems that are employed “in the field”. We will investigate in this project options for learning in low-power unconventional hardware that is based on spiking neural networks (SNNs) implemented in analog neuromorphic hardware combined with nano-scale memristive synaptic devices. Hence, the envisioned computational paradigm combines the three most promising avenues for minimizing energy consumption in hardware: (1) analog neuromorphic computation, (2) spike-based communication, and (3) memristive analog memory. Experts in each of these fields will collaborate on the development of a functional prototype system. We will in particular consider recurrent SNNs (RSNNs) as theirinternal recurrent dynamics render them more suitable for real-world AI applications that have temporal input and demand some form of short-term memory. We will adapt a recently developed training algorithm such that it can be used to optimize SNNs in neuromorphic hardware with memristive synapses. “In the field” applications often demand online adaptation of such systems, which often necessitates hardware-averse training procedure. To overcome this problem, we will investigate the applicability of “learning to learn” (L2L) to spiking memristive neuromorphic hardware. In an initial optimization, the hardware is trained to become a good learner for the target application. Here, arbitrarily complex learningalgorithms can be used on a host system with the hardware “in the loop”. In the application itself, simpler algorithms - that can be easily implemented in neuromorphic hardware - provide adaptation of the hardware RSNNs. In summary, the goal of this project is to build versatile and adaptive low-power small size neuromorphic AI machinery based on SNNs with memristive synapses using L2L. We will deliver an experimental system in a real-world robotics environment to provide a proof of concept.; Recurrent Neural Network (RNN); Neuromorphic hardware; Learning; Edge computing; Memristor; Spiking Neural Network (SNN)",2,1,Collaborative,2,1,More than one discipline,20500,30300,NA,NA,NA,NA
202225,07,Sinergia,2021,ETH Domain,Interdisciplinary,Interdisciplinary,Programmes,2323908,TRUE,Degradation mechanisms in photoelectrochemical devices,Degradation; Photoelectrochemistry; Multi-scale; Durability; Corrosion; Experiment; Theory,"Research on photoelectrochemical (PEC) devices has intensified in the last decade due to the urgent need for a transition from fossil to renewable energy sources. PEC devices have the potential to be an essential part of this transition. The two-step energy conversion from solar energy to electricity (i.e. solar cell) and from electricity to chemical energy (i.e. electrolyzer) is combined to a single-step conversion from solar to chemical energy. Higher efficiencies, lower investment, and reduced consumption of materials and land are expected advantages of this approach. Although efficiencies of PEC devices are still not sufficient for commercialization, much progress has been made in the fundamental scientific understanding of which material properties and device configurations are necessary to achieve high-performance PEC devices. However, there is a second technical requirement that is essential to achieve economic and commercial success: The devices should be long-lived enough to achieve a positive energy and cost balance. Many proposed devices show decent efficiencies, but unconvincing long-term stabilities, if they are reported at all. Typically, the efficiency of PEC devices drops to 80% or less of their initial efficiency within hours or even faster.The complexity to address the challenge of long-term stability is rooted in the lack of fundamental scientific understanding, which of the many processes in PEC devices are responsible for the fast decay in efficiency. PEC devices go through a complex sequence of processes to complete their function: light absorption, charge separation, charge diffusion/migration, charge transfer to the surface or cocatalyst, electrochemical reaction, and charge transport in and through the electrolyte/reactant. Via exposure to light and electrical current, the simultaneously occurring processes in the different components can be altered over time and it is not obvious, which of the steps dominate performance degradation. The lack of in-depth studies on PEC device degradation inhibits identifying the limiting process and improving devices.The goal of this project is to study two different yet highly relevant photocatalyst materials to obtain a general understanding of degradation processes and their effect on device performance as well as to define guidelines for degradation testing, mitigation, and accelerated testing protocols. We will focus on scalable particle-based photoelectrode systems. This allows identifying the dominating degradation mechanisms at the atomic, meso as well as at the device scale. We will achieve this goal by experiments combined with atomic- and continuum-scale theoretical calculations. This combination results in the unique opportunity to propagate atomic-scale material changes to the device scale, where they are combined with morphology changes and changes in the local environment to predict the overall effect of degradation and the resulting performance. Given the ability of the multi-scale models to predict experimentally accessible material characteristics and device performance, this will allow linking performance degradation to specific alterations of the materials or the device.The limited number of attempts made to prevent degradation are rooted in the lack of knowledge on photocorrosion or, more generally, on degradation processes in PEC devices. This project will provide significant contributions to fill this knowledge gap and will promote a focus on long-term stability in the field of PEC energy conversion, crucially needed to ensure future sustainable energy supply for the society. The significance and the practical impact of the results of this project will be demonstrated by improving the stability of one of the studied PEC devices by at least one order of magnitude.; Degradation; Photoelectrochemistry; Multi-scale; Durability; Corrosion; Experiment; Theory",3,1,Collaborative,2,1,More than one discipline,NA,20300,20500,NA,NA,NA
